{
  "ledger_id": "LEDGER-SYN-PRED-001",
  "session_id": "EOD-SYN-SESSION-001",
  "ledger_kind": "prediction",
  "specification": "raw-material-processing-v0.1",
  "candidates": [
    {
      "candidate_id": "CAND-SYN-P001",
      "target_key": "TARGET-SYN-001",
      "topic_id": "TOPIC-SYN-001",
      "signal_ids": ["SIGNAL-SYN-001"],
      "learning_function": "lexical",
      "note_type": "vocabulary",
      "decision": "selected",
      "decision_reasons": ["SYNTHETIC-DIRECT-SIGNAL"],
      "confidence": "high",
      "source_span_ids": ["SPAN-SYN-001"],
      "boundary_key": "BOUNDARY-SYN-001",
      "semantic_fidelity": "pass"
    },
    {
      "candidate_id": "CAND-SYN-P002",
      "target_key": "TARGET-SYN-002",
      "topic_id": "TOPIC-SYN-001",
      "signal_ids": ["SIGNAL-SYN-002"],
      "learning_function": "complete-expression",
      "note_type": "context-cloze",
      "decision": "selected",
      "decision_reasons": ["SYNTHETIC-DIRECT-SIGNAL"],
      "confidence": "medium",
      "source_span_ids": ["SPAN-SYN-002"],
      "boundary_key": "BOUNDARY-SYN-002A",
      "semantic_fidelity": "pass"
    },
    {
      "candidate_id": "CAND-SYN-P003",
      "target_key": "TARGET-SYN-003",
      "topic_id": "TOPIC-SYN-002",
      "signal_ids": ["SIGNAL-SYN-003"],
      "learning_function": "guidance",
      "note_type": "guidance",
      "decision": "selected",
      "decision_reasons": ["SYNTHETIC-GUIDANCE-SIGNAL"],
      "confidence": "medium",
      "source_span_ids": ["SPAN-SYN-003"],
      "boundary_key": "BOUNDARY-SYN-003",
      "semantic_fidelity": "pass"
    }
  ],
  "privacy": {
    "classification": "synthetic",
    "repository_allowed": true,
    "retention_policy": "permanent-test-fixture"
  }
}
